{
  "product_name": "",
  "category": "",
  "platform": "",
  "business_goal": "",
  "target_audience": [],
  "features": [],
  "parameters": {},
  "materials": [],
  "use_cases": [],
  "customer_pains": [],
  "customer_concerns": [],
  "competitor_claims": [],
  "differentiators": [],
  "evidence": [],
  "after_sales": [],
  "constraints": []
}